state,key,svn,english,translation
CURRENT,stargate_part1_manufacturing6,2448,We should be able to get by just buying the raw materials we need through the Trade system.  If there isn't enough metallic minerals available then you'll have to send your other ship around the Sector to pickup the resources you need from other stations.,"mi ken pali e ale kepeken ni taso: ijo tan nasin esun.  kiwen suno pi mute pona li lon ala la, o pana e ilo tawa ante sina.  ona li ken tawa lon ma li ken kama jo e ijo wile ante tan tomo esun ante."
CURRENT,stargate_part1_objective_extrafabricator,2448,Setup another fabricator,o pana e ilo pali kin
CURRENT,stargate_part1_objective_extraassembler,2448,Setup another assembly table,o pana e supa pali kin
CURRENT,stargate_part1_objective_manufacture2,2448,Manufacture [*X/*Y] STARGATE FRAMES,o pali e SIJELO ILO [*X/*Y] PI LUPA MUN
CURRENT,stargate_part1_objective_deliver2,2448,Deliver [*X/*Y] STARGATE FRAMES,o pana e SIJELO ILO [*X/*Y] PI LUPA MUN
CURRENT,stargate_part1_objective_manufacture3,2448,Manufacture [*X/*Y] STARGATE FRAMES,o pali e SIJELO ILO [*X/*Y] PI LUPA MUN
CURRENT,stargate_part1_objective_deliver3,2448,Deliver [*X/*Y] STARGATE FRAMES,o pana e SIJELO ILO [*X/*Y] PI LUPA MUN
CURRENT,stargate_part1_action_deliverframes,2448,Deliver *X Stargate Frames,o pana e sijelo ilo *X
CURRENT,stargate_part1_framdelivery,2448,Stargate Frames,sijelo ilo pi lupa mun
CURRENT,stargate_part1_completion,2448,Well done on completing the frame of the Stargate. There is still a lot of work to do.,sijelo ilo pi lupa mun la pini la sina pona.  pali kama mute li lon.
CURRENT,stargate_part2_title,2448,Stargate Part 2,lupa mun (kipisi 2)
CURRENT,stargate_part2_intro1,2448,Continue help on The Stargate Project,o awen pona e pali pi lupa mun
CURRENT,stargate_part2_intro2,2448,The Stargate Project demands your help! Upscale your manufacturing with new resources to assist the project.,pali pi lupa mun li wile e pona sina!  o suli e ken pali ilo sina.  o esun e ijo sin tawa pali suli kepeken ilo wile sin.
CURRENT,stargate_part2_setup1,2448,Continue help on The Stargate Project,o awen pona e pali pi lupa mun
CURRENT,stargate_part2_setup2,2448,Manufacture Stargate Resin,o pali e ko pi lupa mun
CURRENT,tiddlets_part1_title,2448,The Trouble with Tiddlets,pakala Sipa
CURRENT,tiddlets_character_artemis,2448,Prof. Artemis Toppingbury,jan sona Atemitopipuli
CURRENT,tiddlets_character_swanson,2448,Dr. Magnus Swanson,jan sona Makusanson
CURRENT,tiddlets_character_tiddlet,2448,???,???
CURRENT,tiddlets_shipname_artemis,2448,Artemis Toppingbury,jan Atemitopipuli
CURRENT,tiddlets_part1_intro1,2448,What is a ship like yours doing all the way out here?,tomo tawa sina li lon ma pi weka ni tan seme?
CURRENT,tiddlets_part1_intro2,2448,"Maybe you can help?  I'm looking for creatures that usually live on small isolated asteroids, like the one in this system.","sina ken ala ken pona e mi?  mi alasa e soweli.  mute la soweli wile li lon kiwen mun taso lili, sama wan ni lon kulupu sike ni."
CURRENT,tiddlets_part1_intro3,2448,If you find anything make sure to tell me.,sina kama lukin e soweli la o toki tawa mi.
CURRENT,tiddlets_part1_foundtiddlets1,2448,My gods. You've found them.,sewi a.  sina jo e ona.
CURRENT,tiddlets_part1_foundtiddlets2,2448,Oh god. They're still alive??,sewi a.  ona li moli ala anu seme??
CURRENT,tiddlets_part1_foundtiddlets3,2448,Oh jesus. There's two of them!,sewi a.  tu li lon!
CURRENT,tiddlets_part1_foundtiddlets4,2448,"Captain, you've made an incredible discovery. We have seen these interstellar lifeforms before, on large asteroids deep in uncharted space. But never alive. And you've found a pair!","jan lawa o, sina kama e ijo suli.  tenpo pini la jan li lukin e soweli ni, lon kiwen suli lon ma mun pi weka mute.  taso tenpo ale la moli.  kin la tu a!"
CURRENT,tiddlets_part1_foundtiddlets5,2448,We call them the Tiddlets.,nimi ona li soweli Sipa
CURRENT,tiddlets_summary,2448,Help Prof. Artemis Toppingbury with his research.,o pona e alasa sona pi jan sona Atemitopipuli
CURRENT,tiddlets_part1_accept,2448,ACCEPT,O OPEN
CURRENT,tiddlets_part1_deliver,2448,DELIVER TIDDLETS,O PANA SIPA
CURRENT,tiddlets_part1_setup1,2448,"I should introduce myself. My name is Artemis Toppingbury, and I'm a professor at the Institute of Interstellar Lifeforms.  We've been trying to find a live Tiddlet for years now.",mi o pana e nimi mi.  mi jan Atemitopipuli li jan sona lon tomo sona pi soweli mun.  tenpo pini mute pi sike suno la mi alasa e soweli Sipa pi moli ala.
CURRENT,tiddlets_part1_setup2,2448,"This is a massive breakthrough. Bring the Tiddlets on board, carefully, using a Logistics Drone. Once you have them, meet me at the Institute for Interstellar Lifeforms.  We're at Starbase S*X.",ni li sona sin wawa. o kama pona e soweli Sipa tawa tomo kepeken ilo tawa ilo.  jo la o kama tawa mi lon tomo sona pi soweli mun. mi lon kulupu sike S*X.
CURRENT,tiddlets_objective_dronebay,2448,Install at least one Drone Bay,o pana e tomo pi ilo tawa ilo
CURRENT,tiddlets_objective_drone,2448,Purchase at least one Logistics Drone,o esun e ilo tawa ilo
CURRENT,tiddlets_objective_recovertiddlets,2448,Recover the Tiddlets [*X/*Y],o kama jo e soweli Sipa [*X/*Y]
CURRENT,tiddlets_objective_delivertiddlets,2448,Deliver the Tiddlets to the Institute for Interstellar Lifeforms,o pana e soweli Sipa tawa tomo sona pi soweli mun
CURRENT,tiddlets_part1_sendingshuttle,2448,You managed to bring them back? Amazing! I'll be here in a second.,sina jo e ona anu seme? pona mute! mi kama lon tenpo poka.
CURRENT,tiddlets_part1_delivered1,2448,This is the greatest day of my life!,ni li tenpo suno pona nanpa wan lon ale mi!
CURRENT,tiddlets_part1_delivered2,2448,To be the first to discover and study an entirely new life form. One native to deep space! Think of all we can learn from these little creatures!,jan nanpa wan pi kama sona soweli mun sin. soweli tan ma mun pi weka mute! sona mute li ken kama tan soweli ni!
CURRENT,tiddlets_part1_delivered3,2448,"I mean, you'll get some credit for finding them, of course. But I've waited my whole life for a moment like this.",lon la sina alasa pona e ona la jan ante li sona e pona kama tan sina. taso mi awen e tenpo ni lon tenpo pini ale mi.
CURRENT,tiddlets_part1_setup3,2448,"Now we know where to look, we may be able to find more of them in deep space.","tenpo ni la mi sona e ma alasa pona la, mi ken alasa pona e soweli mute lon ma mun weka."
CURRENT,tiddlets_part1_setup4,2448,"The asteroid where you found them has a large iron and aluminium core, with some unusual crystalline structures on the outside.",ona li kama tan kiwen ni: insa ona li kiwen suno pimeja li kiwen suno walo.  selo li jo e kiwen mani nasa.
CURRENT,tiddlets_part1_setup5,2448,There are similar asteroids within this sector that have been recorded and scanned.  Nobody would bother trying to mine such worthless rocks. They might not have looked too closely.,kiwen mun sama li lon kipisi ma mun ni.  mi awen e sona ma ona.  mani ala pi ken kama la jan ante li kama ala lukin e kiwen ni.  ken la jan ala li lukin pona e kiwen ni.
CURRENT,tiddlets_part1_setup6,2448,I think it's worth searching there for more of these creatures.,pilin mi la mi o alasa e soweli Sipa mute lon kiwen ni.
CURRENT,tiddlets_objective_investigate,2448,Investigate asteroid S*X,o lukin pona e kiwen S*X
CURRENT,tiddlets_objective_tiddletscount,2448,*X Tiddlets on board,soweli Sipa *X lon tomo
CURRENT,tiddlets_objective_deadcount,2448,*X Dead tiddlets on board,*X soweli Sipa moli *X lon tomo
CURRENT,tiddlets_part1_reproduction1,2448,"Oh god, the tiddlets!!!",sewi a!  soweli sipa a!!!
CURRENT,tiddlets_part1_reproduction2,2448,"Oh my goodness, I hope they're ok! What's happening??","ike a. mi wile e ni: ona li pona. Seme li kama??"""
CURRENT,tiddlets_part1_reproduction4,2448,Oh this is just such incredible news. But what was the condition? Maybe these ones were already fertile and pregnant? Did you see any mating behaviours? I need to do more analysis.,"ni li sona pi pona mute. taso tan seme? ken la soweli ni li kama mama lon tenpo open, anu seme? sina lukin ala lukin e unpa? mi wile pali sona mute."
CURRENT,tiddlets_part1_reproduction5,2448,Keep looking Captain. Bring them all back to us when you're done.,"o awen alasa, jan lawa o. pini la o kama e ale tawa mi."
CURRENT,tiddlets_part1_death1,2448,No! Nooooo! Captain what happened? What did you do??,"ike! ike aaaaaa! jan lawa o, seme li kama?  sina pali e seme??"
CURRENT,tiddlets_part1_death3,2448,"It looks like they died of shock during the hyperspace jump.  Oh goodness, this is such horrible news.  Did any of them survive?","lukin la ona li kama moli tan nasa pi tawa suli.  ike a la, ni li ijo kama pi ike mute.  ale ala ale li moli?"
CURRENT,tiddlets_part1_death4,2448,"We'll have to be so careful from now on, Captain. I suggest a maximum hyperspace jump range of *X light years while you have these creatures on board. We can't let any more of them perish this way.","mi wile nasin pi pona mute lon tenpo kama, jan lawa o.  pilin mi la o kepeken tawa suli pi nanpa suli *X taso lon tenpo pi jo soweli ni.  mi wile ala pana e ken ni: soweli mute li kama moli."
CURRENT,tiddlets_part1_delivered5,2448,"I've been analysing the onboard sensor data while you've been travelling around.  They don't exhibit any sort of physical mating behaviour, but there is a detectable energy exchange going on, and always between groups of three.","tenpo tawa sina la mi lukin sona e sona tan ilo lukin insa pi tomo ni.  ona li unpa ala tawa lukin la, wawa li tawa kon tan soweli wan tawa soweli ante.  tenpo ale la kulupu li soweli tu wan."
CURRENT,tiddlets_part1_delivered6,2448,"They must be reproducing through some form of telepathy, and only in triplets, and only in hyperspace!  No wonder they're such a rare creature.","mi pilin e ni: soweli li unpa kepeken nasin lawa kon nasa; lon kulupu tu wan taso, lon tawa suli taso!  soweli li mute ala la ni li nasa ala."
CURRENT,tiddlets_part1_delivered8,2448,"You'll be getting a call from Dr Swanson very soon.  He funds my lab and all of my research.  I've talked him into directing some of our research grant to you, as a fair reward.",tenpo kama poka la jan sona Makusanson li toki tawa sina.  ona li pana e mani ale tawa pali sona mi.  mi toki e ni tawa ona: o pana e mani tawa sina sama pona.
CURRENT,tiddlets_part1_swanson1,2448,"Captain. On behalf of the Institute for Interstellar Life, thank you. A monumental discovery.",jan lawa o. sina pona tawa tomo sona pi soweli mun.
CURRENT,tiddlets_part1_swanson2,2448,"Now let's talk real. Scientists like Artemis like to take all the credit, and bask in the glory of their peers. If your name does show up in their research paper, you can bet it will be on the very last page, in the smallest font available.","mi o toki pona.  jan sona sama jan Atemitopipuli la, ni li suli: ona li pona tawa jan sona ante.  nimi sina li lon lipu sona ona la, o sona e ni: ona li lon monsi lipu, lon sitelen pi lili mute nanpa wan."
CURRENT,tiddlets_part1_swanson3,2448,"And despite funding his work for years now, my name will be even lower. It's fine really. We have different aims.  He can have the glory. I'm interested in the breakthroughs. The science that comes from these discoveries. The potential.",mi pana e mani tawa pali sona ona lon tenpo suli. taso nimi mi li anpa kin. taso pona. mi wile e ijo ante. jan sona ni li ken pona tawa lukin pi jan ante. mi wile e kama sona suli. sona sin li kama tan ijo sin. wawa ken a.
CURRENT,tiddlets_part1_tiddletdelivery,2448,Deliver Tiddlets,o pana e soweli Sipa
CURRENT,tiddlets_part2_title,2448,"The Trouble with Tiddlets, Part 2",pakala Sipa (part 2)
CURRENT,tiddlets_part2_medium,2448,MEDIUM HOP DISTANCE,SULI MESO PI TAWA SULI
CURRENT,tiddlets_part2_short,2448,SHORT HOP DISTANCE,SULI LILI PI TAWA SULI
CURRENT,tiddlets_part2_long,2448,LONG HOP DISTANCE,SULI SULI PI TAWA SULI
CURRENT,tiddlets_part2_advert,2448,"Captain. We're hoping to run some more experiments on the new life form I discovered. The Toppingbury Tiddlet. If you could visit my institute, I have a contract that may be of interest to you.",jan lawa o.  mi wile kama sona lon nasin sin kepeken soweli mun ni pi sona sin: soweli Sipa Atemitopipuli. o kama tawa tomo sona mi. mi pana e pali esun la ona li ken pona tawa sina.
CURRENT,tiddlets_part2_objective_visitinstitute,2448,Travel to the Institute for Interstellar Lifeforms,o tawa tomo sona pi soweli mun
CURRENT,tiddlets_part2_setup2,2448,The word on the grapevine is that the Nobel prize committee may be looking at our work.,toki la kulupu Nobel pi pona sona li ken lukin e pali sona mi.
CURRENT,tiddlets_part2_setup3,2448,"Exactly. So we must continue this important research. We have a great deal of data already, but we need to take some more measurements and refine some of our estimates. We are particularly interested in their reproductive process.",pona. mi wile awen e pali sona suli. tenpo ni la mi jo e sona mute la mi wile kama jo e sona sin. ni li pona e sona nanpa pi pona meso. mi wile sona mute e nasin unpa.
CURRENT,tiddlets_part2_setup4,2448,"We're going to send you a batch of Toppingbury Tiddlets, and we want you to run a series of tests on them under Hyperspace conditions.",mi pana e kulupu soweli Sipu Atemitopipuli. mi wile e ni: sina pali sona kepeken ona lon tenpo pi tawa suli.
CURRENT,tiddlets_part2_setup5,2448,"We're also sending you a pair of specially modified science stations, with a sensor attuned to their telepathic reproductive process. I wrote the firmware myself. We will be able to see deep into their minds when this magical process takes place.",mi pana kin e ilo lukin sona namako tu. ilo li ken lukin e nasin unpa pi wawa lawa nasa. mi sitelen e nasin ilo ona. tenpo pi nasin nasa pona unpa li kama la mi ken lukin pona e insa pi lawa soweli.
CURRENT,tiddlets_part2_objective_receivetiddlets,2448,Receive [*X/*Y] Tiddlets,o kama jo e soweli Sipa [*X/*Y]
CURRENT,tiddlets_part2_objective_receivesensors,2448,Receive [*X/*Y] Telepathic Sensor Stations,o kama jo e ilo lukin sona pi unpa lawa [*X/*Y]
CURRENT,tiddlets_part2_setup7,2448,"We need to zero in on exactly how long the Tiddlets can survive in hyperspace. This will regrettably require you to jump beyond the safe distance, and to record the effect on their telepathic process. Some of the Tiddlets may be lost in the process of this experiment.",mi wile sona e ni: soweli Sipa li ken awen pi moli ala lon tenpo suli semi pi tawa suli?  ike la sina wile tawa suli pi ken moli soweli.  ni la mi ken lukin e ante tawa nasin ona pi wawa nasa lawa.  ken la soweli Sipa li moli tan ni.
CURRENT,tiddlets_part2_setup8,2448,That does make me quite uncomfortable.,mi pilin ike tan ni.
CURRENT,tiddlets_part2_objective_installsensors,2448,Install Sensor Stations [*X/*Y],o pana e ilo lukin sin [*X/*Y]
CURRENT,tiddlets_part2_objective_ftlcharges,2448,Have at least *X FTL fuel,o jo e poki wawa *X pi tawa suli
CURRENT,tiddlets_part2_mediumjumps1,2448,Let's start simple. A couple of medium range hops should do the trick.,o open pona. tu la tawa suli meso li pona.
CURRENT,tiddlets_part2_objective_mediumjumps,2448,Perform medium range hops [*X/*Y],o tawa suli meso [*X/*Y]
CURRENT,tiddlets_part2_mediumjumps2,2448,Excellent. The sensor is working nicely and we are receiving science packets. Let's do one more medium range hop to gather some more data.,pona mute. ilo lukin li lukin pona li pana sona. o tawa suli meso lon tenpo wan kin. ni li pana e sona mute.
CURRENT,tiddlets_part2_shortjump2,2448,"We'd like to see the effect of a very short hop.  We want to know if there is a minimum hyperspace distance, below which their reproductive process simply does not occur.  Make the jump and let's see how they do.",mi wile sona e ni: seme li kama tan tawa suli pi lili mute?  tawa li lili mute la unpa li weka ala weka?  o tawa suli lili la mi lukin.
CURRENT,tiddlets_part2_objective_shortjump,2448,Perform a short range hop,o tawa suli lili
CURRENT,tiddlets_part2_finalexperiment2,2448,I'll hand you over to my colleague for the final experiment.,jan pali sama mi li pini e pali sona.  mi pana e sina tawa ona.
CURRENT,tiddlets_part2_finalexperiment3,2448,"Captain, the Professor has asked me to oversee this phase of the experiment.","jan lawa o, jan sona Atemitopipuli li wile e ni: mi lawa e kipisi ni pi pali sona."
CURRENT,tiddlets_part2_finalexperiment4,2448,"I need you to make a long range jump. Beyond the safe tiddlet distance.  We need to know what happens to them under the effects of Hyperspace Shock, and this will also help us to calculate that safe distance more accurately.",mi wile e ni: sina tawa suli suli.  suli pi ken moli Sipa.  mi wile sona e ni: seme li kama tawa soweli lon pakala pi tawa suli?  sona ni la mi ken sona pona e suli tawa pi moli Sipa ala.
CURRENT,tiddlets_part2_finalexperiment5,2448,Get into position and make the long range jump.,o tawa ma wile. ma ni la o open e tawa suli suli.
CURRENT,tiddlets_part2_objective_longjump,2448,Make a jump longer than the Tiddlet safe distance,o tawa suli kepeken suli pi ken moli Sipa
CURRENT,tiddlets_part2_return1,2448,*X of the Tiddlets appear to have perished.,lukin la soweli Sipa *X li moli.
CURRENT,tiddlets_part2_return3,2448,The sensor data suggests the telepathic mating ritual does begin during the longer jump.  But the telepathic energy induced between them produces so much heat at their core that they ultimately catch fire and burn out from the inside.,"sona tan ilo lukin la, nasin unpa pi wawa nasa lawa li open lon tawa suli suli.  taso wawa unpa li mute ike la, ona li pana e seli mute.  insa li kama seli, li seli e sijelo ale."
CURRENT,tiddlets_part2_return4,2448,One can only imagine what that must feel like.,mi pilin e ni: moli seli li pilin ike tawa soweli.
CURRENT,tiddlets_part2_objective_return1,2448,Return the Tiddlets to the Institute,o tawa tomo sona pi soweli mun
CURRENT,tiddlets_part2_objective_return2,2448,Return the bodies to the Institute,o pana e soweli moli tawa tomo sona
CURRENT,tiddlets_part2_debrief1,2448,"We've made another interesting discovery!  Our sensors were correct, and it appears some type of tiny crystal has been formed at the core of several of the dead creatures.  Almost like a small diamond.",sona sin kin pona a!  ilo lukin li sona pona.  lukin la insa pi soweli moli li pana e kiwen mani lili nasa.
CURRENT,tiddlets_part2_debrief2,2448,"It must have formed in the final moments of their life. All that telepathic energy, focussed into a lethal feedback loop!  Our lab tells us the crystals aren't like anything they've ever seen before.  Let's get the remaining samples in for analysis.",lukin la ona li mama tan tenpo moli.  wawa mute pi kon nasa lawa li sike moli!  tomo sona li toki e ni: kiwen ni li nasa.  mi sona ala e kiwen ni lon tenpo pini.  o kama e soweli moli ale tawa pali sona.
CURRENT,tiddlets_part3_title,2448,"The Trouble with Tiddlets, Part 3",pakala Sipa (kipisi 3)
CURRENT,tiddlets_part3_farmname,2448,The Tiddlet Farm,ma mama Sipa
CURRENT,tiddlets_part3_hoppername,2448,Short Hopper,ilo pi tawa suli lili
CURRENT,tiddlets_part3_advert,2448,"Captain, there have been several developments with the Tiddlet Research Program. We are in need of a competent starship pilot once again.  Please visit us at the Institute for Interstellar lifeforms and I can tell you more.","jan lawa o, pali sona Sipa li jo e kama sin mute.  tenpo sin la mi wile e jan pona pi ilo tawa mun.  o kama tawa tomo sona pi soweli mun la mi toki mute."
CURRENT,tiddlets_part3_objective_visitinstitute,2448,Travel to the Institute for Interstellar Lifeforms,o tawa tomo sona pi soweli mun
CURRENT,tiddlets3_summary,2448,Assist the Institute with their experiments,o pona e pali pi tomo sona soweli
CURRENT,tiddlets_part3_setup2,2448,"Regrettably, Professor Toppingbury has been forced to take a leave of absence.  From the stress of his work, you understand.","ike la, jan sona Atemitopipuli li tawa weka. pilin ike pi wawa pali li pakala e ona."
CURRENT,tiddlets_part3_setup3,2448,"We know how they reproduce now, and we know their limits. During hyperspace travel, 3 of them will telepathically reproduce.","tenpo ni la mi sona e nasin unpa Sipa e pini ni. tenpo pi tawa suli la soweli tu wan li unpa."""
CURRENT,tiddlets_part3_setup4,2448,"We're not quite sure yet how long it takes for their children to grow up. However, we've noticed they hop at exactly the same time their parents do.",tenpo ni la mi sona ala e ni: soweli lili li kama soweli suli lon tenpo seme? taso mi sona musi e ni: soweli lili en soweli mama li tawa sewi lili lon tenpo sama.
CURRENT,tiddlets_part3_setup5,2448,"This isn't important, but I thought you might find it amusing.",ni li suli ala li musi taso.
CURRENT,tiddlets_part3_setup6,2448,"As you've already seen, they experience hyperspace shock if they've been in hyperspace travel for too long.",sina lukin e ni lon tenpo pini: tawa suli pi suli ike la soweli Sipa li kama moli.
CURRENT,tiddlets_part3_setup7,2448,"But the key is in the final stage of their life-cycle.  We know if we expose them to hyperspace shock, their telepathic energies are so strong that a small crystal is formed in their final moments.",tenpo moli li ijo suli.  mi sona e ni: tenpo moli la wawa kon nasa lawa ona li wawa mute li mama e kiwen mani lili nasa.
CURRENT,tiddlets_part3_setup8,2448,"We've been studying the crystals we've recovered so far.  They resonate in subspace in a way we've never seen before.  Some of the crystals are entangled at the quantum level, and resonate together.  Apply a signal to one and another responds, instantly, across any distance.","mi lukin sona e kiwen mani nasa jo pi tenpo ni.  ona li tawa nasa lon nasin ni: tenpo pini la mi lukin ala e sama.  tenpo la kiwen wan en kiwen ante li kulupu nasa li tawa nasa sama.  mi ante e kiwen wan la, kiwen ante li pilin e ona, lon weka suli."
CURRENT,tiddlets_part3_setup9,2448,There are so many potential applications.,ni li ken kepeken nasin pona mute.
CURRENT,tiddlets_part3_setup10,2448,"So, onto business.  There is a scientist by the name of Dr. Julian Martinez in a nearby system. He had a moment of fame recently after a daring rescue of his brother.  He has a ship for sale that we believe will be of some use.",pona.  tawa pali.  jan sona Julijanmasine li lon kulupu sike poka.  ken la sina sona e nimi.  tenpo pini poka la ona li kama pona e jan sama ona tan pakala.  ona li wile esun e ilo tawa.  mi pilin e ni: mi ken kepeken pona e ilo ni.
CURRENT,tiddlets_part3_setup11,2448,"Travel to the noble Doctor and buy his ship. He wants a million credits, which is ridiculous.  He thinks his invention is worth that much.  Negotiate with him, knock that price down, and I'll wire the funds directly to him.  If you can improve his offer then I'll pay you 20% of the savings as a bonus.",o tawa jan sona pona.  o esun e ilo tawa.  ona li wile e mani $1M la ni li nasa musi.  ona li pilin e ni: ilo sin ona li wile kama e mani pi mute ni.  o toki esun tawa ona.  o lili e mani esun la mi pana e mani tawa ona.  sina ken lili e mani esun la mi pana e kipisi mani 20% sama namako.
CURRENT,tiddlets_part3_objective_blackhole,2448,Travel to the Blackhole S*X,o tawa lupa pimeja S*X
CURRENT,tiddlets_part3_objective_martinez,2448,Buy Dr. Martinez's ship,o esun e ilo tawa tan jan sona Julijanmasine
CURRENT,tiddlets_part3_objective_institute,2448,Bring the ship to the Institute,o kama e ilo tawa tawa tomo sona
CURRENT,tiddlets_part3_martinez_a1,2448,Captain! It's so good to hear from you again.  How have you been?,jan lawa o!  lukin sin sina li pona tawa mi.  sina pona ala pona?
CURRENT,tiddlets_part3_martinez_a2,2448,"We've been taking some time to recover.  I must admit, I spent so long planning my brother's rescue, I almost don't know what to do with myself.",mi kepeken tenpo pi kama pona.  kama pona pi jan sama mi la mi pali wawa lon tenpo suli.  pini ni la mi sona ala e ni: mi wile pali e seme?
CURRENT,tiddlets_part3_martinez_b2,2448,"Marcus has been in and out of hospital since the rescue.  He has burns all over his body, and took quite a serious dose of radiation.",tenpo pini poka la mute la jan Makusanson li lon tomo misikeke.  selo ona li pakala seli mute.  sijelo li pakala tan wawa nasa suli.
CURRENT,tiddlets_part3_martinez_b3,2448,"Of course, you already know that, because it happened while he was uploading your data.","sona la sina sona e ni, tan ni: pakala li kama lon tenpo pana pi sona sina."
CURRENT,tiddlets_part3_martinez_b5,2448,"The ship is up for sale.  I can't bear to be on-board any longer.  The price is $1M.  But I suppose you did help to build the hop drive, so I'll let you have it for $800k.","mi wile esun e tomo tawa.  wile li mani $1M.  tenpo pini la sina pona e pali ilo la, mi ken esun tawa sina tan mani $800k."
CURRENT,tiddlets_part3_martinez_c1,2448,Why are you here?,sina lon ma ni tan seme?
CURRENT,tiddlets_part3_martinez_c2,2448,Ten years I worked on his rescue.  Ten years.,mi pali lon kama pona ona lon sike suno 10.  sike suno 10.
CURRENT,tiddlets_part3_martinez_c3,2448,"Do you know what it's like to die from radiation poisoning?  No?  I do.  Since your rescue attempt I've watched it happen.  Hair falls out, organ failure rips through the body.  Vomiting.  Sick and blood.  For days on end.",sina sona ala sona e nasin tawa moli tan pakala pi wawa nasa?  ala?  mi sona.  mi lukin e ona.  linja lawa li weka.  insa sijelo li pakala.  weka jaki uta.  telo jaki loje.  lon tenpo suno mute.
CURRENT,tiddlets_part3_martinez_c4,2448,They wouldn't even let me near him.,mi ken ala poka ona.
CURRENT,tiddlets_part3_martinez_c5,2448,"You did that to him, Captain.","sina pakala ni e ona, jan lawa o."
