state,key,svn,english,translation
CURRENT,tutorial_smeltersstoragetoolbar,2448,"We can make things more efficient for our crew by telling them to store SCRAP METAL near to the SMELTER.\n\nSelect STORAGE from the CONSTRUCTION toolbar, then select SCRAP METAL from the list.",sina ken pona e pali kiwen. o toki e ni tawa jan: o awen e KIWEN SUNO PAKALA lon poka pi ILO KIWEN SELI.\n\no wile e AWEN tan sitelen lawa PALI.
CURRENT,tutorial_smeltersstorageworld,2448,Now drag out a storage zone near to the SMELTER.,tenpo ni la o sitelen e ma leko awen lon poka pi ILO KIWEN SELI.
CURRENT,tutorial_smeltersstoragedone,2448,The crew will move all the SCRAP METAL into this zone.,jan li kama tawa e KIWEN SUNO PAKALA ale tawa ma ni.
CURRENT,tutorial_trade_title,2448,TRADE,ESUN
CURRENT,tutorial_tradewaitforsellable,2448,Your crew will now use the equipment to produce some STARGATE FRAMES.,tenpo ni la jan sina li kama kepeken ilo pali. ona li kama pali e SIJELO PI LUPA MUN.
CURRENT,tutorial_tradeothersupplies,2448,"We can use the TRADE system to buy raw materials to produce more STARGATE FRAMES, as well as resources we will need to survive.\n\nReopen the TRADE screen.",SIJELO PI LUPA MUN la wile pali mute la sina ken kepeken nasin ESUN. kin la sina ken esun e ijo suli ante tawa awen jan.\n\no open sin e lipu ESUN.
CURRENT,tutorial_tradebuyminerals,2448,METALLIC MINERALS can be smelted into METAL INGOTS just like SCRAP METAL.\n\nAdd all the METALLIC MINERALS to the trade.,sina ken pona e KIWEN PI KIWEN SUNO tawa LEKO KIWEN SUNO sama KIWEN SUNO PAKALA.\n\nKIWEN PI KIWEN SUNO la o pana e ale tawa esun.
CURRENT,tutorial_tradebuysmelter,2448,We will also need another SMELTER to begin processing those METALLIC MINERALS.\n\nFind the SMELTER under the INDUSTRY tab and add one to the order.,sina wile kin e ILO KIWEN SELI kin wan. ilo sin li ken pona e KIWEN PI KIWEN SUNO.\n\no alasa e ILO KIWEN SELI lon lipu PALI. o pana e wan ni tawa kulupu esun.
CURRENT,tutorial_tradebuymore,2448,This is a good opportunity to stock up on some other resources that are critical for life support.\n\nWe'd recommend you purchase:\n\n - 2x FUEL\n - 2x OXYGEN\n - 2x WATER\n - 2x FOOD\n\n- HIRE 5 MORE CREW\n\nCONFIRM the order when you are done.,ni li tenpo pona tawa ni: sina kama jo e ijo suli pi awen jan.\n\npona la o esun e:\n\n - 2x TELO WAWA\n - 2x KON PONA\n - 2x TELO\n - 2x MOKU\n\n- O ESUN E JAN MUTE 5\n\nO LUKIN PONA e esun lon pini.
CURRENT,tutorial_tradeinstallsmelter,2448,"Once those goods have arrived, you should install your second SMELTER somewhere near the first.",ijo esun li pini kama la o pana e ILO KIWEN SELI nanpa tu lon poka pi nanpa wan.
CURRENT,tutorial_tradesmeltmetallicminerals,2448,Set the SMELTER to process those METALLIC MINERALS you bought into more METAL INGOTS.,o lawa e ILO KIWEN SELI tawa ni: ona li pona e KIWEN PI KIWEN SUNO tan esun sina tawa LEKO KIWEN SUNO.
CURRENT,tutorial_productionsuccess,2448,"Well done, you are now all set to produce STARGATE FRAMES.",pali pona. tenpo ni la sina ken pali e SIJELO PI LUPA MUN.
CURRENT,tutorial_fleetcrew,2448,We will need a crew. Hire five CREW MEMBERS from the TRADE screen.,o esun e JAN 5 tan lipu ESUN.
CURRENT,tutorial_fleetcrew_shiftclick,2448,NOTE: You can SHIFT CLICK to hire in multiples of 5.,O SONA: wile esun jan pi nanpa 5 la sina ken LUKA SHIFT.
CURRENT,tutorial_fleetspacesuits,2448,Those crew will also need SPACESUITS as there is no atmosphere onboard our ship yet.\n\nOrder five SPACESUITS for the new crew.,kin la jan sin li wile e LEN MUN tan ni: tomo li jo ala e kon lon tenpo ni.\n\njan sin la o esun e LEN MUN 5.
CURRENT,tutorial_fleettradeconfirm,2448,CONFIRM the trade.,o PINI PONA e esun.
CURRENT,tutorial_fleetcrewarrival,2448,Your new crew will arrive by shuttle.,jan sin li kama kepeken tomo tawa lili.
CURRENT,tutorial_fleetresources,2448,We also need resources for the ship to function.\n\nUse the TRADE screen to buy:\n- 5x FUEL\n- 5x OXYGEN\n- 5x FTL CHARGE\n- 2x FOOD\n- 2x WATER.\n\nCONFIRM the trade when you are done.,ilo tawa li wile kin e ijo sulo.\n\no kepeken lipu ESUN o esun e:\n-n 5x TELO WAWA\n- 5x KON PONA\n- 5x WAWA PI TAWA SULI\n- 2x MOKU\n- 2x TELO.\n\no PONA e esun lon pini.
CURRENT,tutorial_fleetwaitforpowerup,2448,Your crew will now power up the ship and bring the engines and life support online.,tenpo ni la jan li pana e wawa tawa ilo tawa. ni li open e ilo pi wawa tawa e ilo pi awen jan.
CURRENT,tutorial_flight_title,2448,FLIGHT,TAWA SEWI
CURRENT,tutorial_flightengines,2448,We can directly control our engine THROTTLE from here.\n\nTry increasing your engine throttle with this control.,sina ken lawa e NANPA WAWA pi tawa ilo lon ni.\n\no suli e wawa tawa kepeken ni.
CURRENT,tutorial_flightturning,2448,"We can also turn the ship by left clicking in TACTICAL mode, in the direction we wish to travel.",kin la sina ken tawa sike e ilo tawa. o luka lon lipu pi NASIN UTALA.
CURRENT,tutorial_flightsetcourse,2448,We can send our ship to a specific location by RIGHT-CLICKING. Try setting a destination by right clicking in the tactical view.,sina ken tawa e ilo tawa sina tawa ma wile kepeken LUKA ANTE. o pana e ma wile kepeken luka ante lon lipu pi nasin utala.
CURRENT,tutorial_flightinformation,2448,"Your crew will continue to operate the ship and keep the engines running as you travel around. Try flying around the system until you have a handle on the controls.\n\nWhen you are ready, bring the ship to a stop by setting the THROTTLE to zero in TACTICAL mode.",tawa la jan li awen pali lon tomo tawa li awen e pona ilo pi wawa tawa. o tawa lili lon ma ni tawa suli po sona lawa sina.\n\nwile pini la o pini e tawa kepeken nanpa ala lon ilo lawa pi WAWA TAWA lon lipu pi NASIN UTALA.
CURRENT,tutorial_finance_title,2448,CONTRACTS,PALI ESUN
CURRENT,tutorial_financemissionscreen,2448,"Now that our ship is up and running, we need to earn our way.  We can complete contracts for financial reward and reputation.\n\nOpen the CONTRACTS screen to see a list of available contracts.",ilo tawa li pona ken la sina wile kama jo e mani. sina pini pona e pali esun la ni li pana e mani e pilin pona pi jan ante tawa sina.\n\no open e lipu pi PALI ESUN. ni la o lukin e kulupu pi pali esun ken.
CURRENT,tutorial_financeselectship,2448,"Contracts are assigned to the ship you currently have selected.\n\nOnly the PROCYON can travel between locations, so select the PROCYON.",ilo tawa lon li jo e pali esun.\n\nilo PROCYON taso li ken tawa ma sin la o kepeken ilo PROCYON.
CURRENT,tutorial_financeselecttransport,2448,"Here we have a TRANSPORT PASSENGER contract, click it to see more details.",ni li pali esun pi TAWA JAN. wile lukin e toki ale ona la o luka e ona.
CURRENT,tutorial_financeassigntransport,2448,This mission requires us to transport a group of people from here to another location in the sector.\n\nClick the accept button to assign this contract to the PROCYON.,pali esun ni li wile e ni: sina tawa e kulupu jan tawa ma ante lon kipisi ma mun ni.\n\no luka e nena pona. ni li pana e pali esun ni tawa ilo PROCYON.
CURRENT,tutorial_financepassengersinbound,2448,The passengers will be delivered to the PROCYON by shuttle.,jan tawa li kama tawa tomo PROCYON kepeken tomo tawa lili.
CURRENT,tutorial_financesectormap,2448,"All passengers have been delivered to the PROCYON, and our FTL drive is operational. We must now plot an FTL jump to their destination.\n\nOpen the SECTOR MAP.",jan tawa ale li lon tomo PROCYON. ilo pi tawa suli li ken. tenpo ni la o wile e nasin pi tawa suli.\n\no open e SITELEN MA.
CURRENT,tutorial_financesetdestination,2448,"This is a map of all the systems in this sector.\n\nOur ship and our space station are located in the middle, where the map is marked YOU-ARE-HERE.\n\nSet a course to the destination (labelled TRANSPORT PASSENGERS) by clicking on it.","ni li sitelen ma pi kulupu sike ale lon kipisi ma mun ni.\n\nilo tawa en tomo mun sina li lon insa, lon sitelen pi toki SINA LON.\n\no pana e nasin tawa ma wile (li jo e nimi O TAWA E JAN) kepeken luka."
CURRENT,tutorial_financeclosesectormap,2448,"Close the SECTOR MAP by clicking the X in the top right corner, or by pressing ESC.",o pini e SITELEN MA kepeken sitelen X lon sewi.
CURRENT,tutorial_financeftlwindow,2448,Open the FTL screen to order the FTL jump.,wile tawa suli la o open e lipu pi tawa suli.
CURRENT,tutorial_financepreparejump,2448,Click on PREPARE JUMP to align the ship and prepare for hyperspace.,wile open pi tawa suli la o luka e nena pi O OPEN E TAWA SULI.
CURRENT,tutorial_financepreparingjump,2448,"The PROCYON will align for hyperspace, and prepare the FTL drive to make the jump.",ilo PROCYON li tawa sike tawa nasin pona pi tawa suli. ona li ken e ilo pi tawa suli.
CURRENT,tutorial_financejump,2448,Click the JUMP button to jump to hyperspace.,wile open pi tawa suli la o luka e nena pi TAWA SULI
CURRENT,tutorial_financehyperspace,2448,We are in hyperspace!,sina lon tawa suli!
CURRENT,tutorial_financearrived,2448,We have arrived at the destination system.,sina lon kulupu sike wile.
CURRENT,tutorial_financeselectmission,2448,We now need to turn in our completed passenger contract.\n\nOpen the CONTRACTS screen and select the passenger mission.,tenpo ni la sina wile pini e pali esun pi tawa jan.\n\no open e lipu pi PALI ESUN. o wile e pali esun pi tawa jan.
CURRENT,tutorial_financeturnin,2448,Click the DELIVER button to drop off the passengers and receive payment,o luka e nena PANA. ni li pana e jan tawa li kama e mani.
CURRENT,tutorial_financeturningin,2448,A shuttle will be dispatched to collect the passengers.,tomo tawa lili li kama li tawa weka e jan tawa.
CURRENT,tutorial_financemissioncomplete,2448,The passengers have all arrived safely. You will now be paid the fee and will also receive points toward your Humanitarian rating - giving you access to more difficult and lucrative missions.,jan ale li pini tawa pona. tenpo ni la sina kama jo e mani. kin la nanpa sina pi pona jan li kama suli. ni li open e nasin tawa pali esun sin. pali esun sin li ken wile e pali pi suli mute la ona li ken pana e mani mute.
CURRENT,tutorial_wrapup_title,2448,END OF TUTORIAL,PINI PI PANA SONA
CURRENT,tutorial_wrapup1,2448,"We've covered the basics. You've learnt how to install equipment on your ship, and how to navigate space.",sina sona e ijo suli. sina ken pana e ilo tawa tomo tawa. sina ken tawa sewi mun.
CURRENT,tutorial_wrapup2,2448,"The career you choose is now up to you.  There are many opportunities to choose from, and you'll learn more as you work.\n\nOpen the CONTRACTS board.",tenpo ni la nasin sina li kama tan wile sina. nasin mute li ken. pali la sina kama sona mute.\n\no open e lipu pi PALI ESUN.
CURRENT,tutorial_wrapup4,2448,"Keep a keen eye out for special systems on the map, you never know who or what you may find there.",o alasa pona e kulupu sike nasa lon sitelen ma. tenpo ala la jan li sona e ni: ijo seme anu jan seme li lon ma ni?
CURRENT,tutorial_wrapupfinal,2448,"Whatever you choose, more instructions will be given when required.\n\nIt's up to you what you do next.",nasin ale la sona mute li kama lon tenpo wile.\n\nnasin kama li tan wile sina.
CURRENT,tutorial_tutorialend,2448,[End of tutorial - Alpha 11],[pini pi pana sona - nanpa musi Apa 11]
CURRENT,tutorial_tutorialskip,2448,Are you sure you wish to skip the tutorial?,sina wile ala wile weka e pana sona?
CURRENT,tutorial_tutorialskipyes,2448,SKIP TUTORIAL,O WEKA E PANA SONA
CURRENT,tutorial_tutorialskipno,2448,RESUME TUTORIAL,O KAMA SONA
CURRENT,tutorial_resin_title,2448,GAS COLLECTORS,ILO LANPAN KON
CURRENT,tutorial_resinstart,2448,We are now going to learn how to produce STARGATE RESIN.,tenpo ni la o kama sona pali e KO PI LUPA MUN.
CURRENT,tutorial_resinintro,2448,"Turning our attention back to the Stargate, the Stargate project also requires us to produce STARGATE RESIN.\n\nWe are going to use the INDUSTRIOUS to collect METREON GAS, refine it, and process it into STARGATE RESIN.",sin la o toki lon lupa mun. pali ona li wile e KO PI LUPA MUN.\n\nkepeken ilo INDUSTRIOUS la sina kama jo e KON METEJAN. sina pona e ona tawa KO PI LUPA MUN.
CURRENT,tutorial_resinintro2,2448,Raise enough money to purchase for INDUSTRIOUS:\n\n- 1x GAS COLLECTOR\n- 1x REFINERY\n- 1x CHEMICAL LAB,o kama jo e mani pi mute pona. ilo INDUSTRIOUS la sina wile esun e:\n\n-1x ILO ALASA KON\n- 1x ILO PI PALI PONA\n-1 1x SUPA PALI PI SONA SELI
CURRENT,tutorial_resinselectnebula,2448,"Before we can start collecting the METREON GAS, we need to move the INDUSTRIOUS to a system containing a GAS CLOUD.\n\nUse the SECTOR MAP to select a suitable destination.",sina wile kama jo e kon Metejan la sina wile tawa e ilo INDUSTRIOUS tawa kulupu sike pi KON KO.\n\no alasa e nasin pona kepeken SITELEN MA.
CURRENT,tutorial_resinjumptonebula,2448,Close the sector map and use the FTL Window to jump the INDUSTRIOUS to the nebula.,o pini e sitelen ma. kepeken lipi pi tawa suli la o tawa e ilo INDUSTRIOUS tawa kon ko.
CURRENT,tutorial_resininstallgascollector,2448,"Install the GAS COLLECTOR, REFINERY and CHEMICAL LAB so that they are close to each other.",o pana e ILO ALASA KON e ILO KIWEN SELI e SUPA PALI PI SONA SELI. ale o kulupu poka.
CURRENT,tutorial_resinpowerup,2448,"Power up the GAS COLLECTOR, REFINERY and CHEMICAL LAB.",o wawa e ILO ALASA KON e ILO PI PALI PONA e SUPA PALI PI SONA SELI.
CURRENT,tutorial_resinrefineryrecipe,2448,Right click on the REFINERY and set its recipe to REFINE METREON GAS.,o luka ante e ILO PI KPALI PONA. o lawa e nasin pali ona tawa PONA KON METEJAN.
CURRENT,tutorial_resinchemicallabrecipe,2448,Right click on the CHEMICAL LAB and set its recipe to MAKE STARGATE RESIN.,o luka ante e SUPA PALI PI SONA SELI. o lawa e nasin pali ona tawa KO PI LUPA MUN.
CURRENT,tutorial_resinconnectgascollector,2448,Connect the GAS COLLECTOR to the REFINERY with a PIPE.,o wan e ILO ALASA KON e ILO PI PALI PONA kepeken NASIN LUPA.
CURRENT,tutorial_resinconnectchemicallab,2448,Connect the REFINERY to the CHEMICAL LAB with a PIPE.,O WAN e ILO PI PALI PONA e SUPA PALI PI SONA SELI kepeken NASIN LUPA.
CURRENT,tutorial_resinsuccess,2448,"Well done, you have started to produce STARGATE RESIN.\n\nWhen you have produced enough, travel back to any COLONY, SHIP YARD or the STARGATE system to sell it to the STARGATE PROJECT.",pali pona. sina open pali e KO PI LUPA MUN.\n\npini pali pi mute pona la o tawa KULUPU TOMO JAN anu MA PALI PI ILO TAWA anu kulupu sike pi LUPA MUN. ma ni la o esun e ko tawa KULUPU PALI PI LUPA MUN.
CURRENT,tutorial_end_title,2448,END OF TUTORIAL,PINI PI PANA SONA
CURRENT,tutorial_docking_title,2448,DOCKING,POKA LUPA
CURRENT,tutorial_dockingstart,2448,We are now going to learn how to dock your ship to another ship.,tenpo ni la sina kama sona poka lupa e ilo tawa sina tawa ilo tawa ante.
CURRENT,tutorial_dockingcheckthrusters,2448,"In order to be able to dock successfully, your ship needs at least four working THRUSTERS.\n\nUse a different ship, or purchase and install four thrusters at a nearby trading post.",wile pi poka lupa pona la ilo tawa sina li wile e ILO LILI PI WAWA TAWA lon nanpa tu tu anu mute.\n\no kepeken ilo tawa ante anu o esun o pana e ilo lili tu tu pi wawa tawa lon tomo esun poka.
CURRENT,tutorial_dockingapproachship_x,2448,Use your main ship engines to get close to the *X.,wile lon poka *X la o kepeken tawa meso pi ilo tawa sina.
CURRENT,tutorial_dockingzoomin,2448,Zoom in so that you can see the docking guides more clearly. They are RED diamonds extending from the docking ports.,wile lukin pona pi nasin poka lupa la o suli e sitelen lukin sina. nasin li leko LOJE (pi tawa sike) lon poka lupa.
CURRENT,tutorial_dockingopenmaneuver,2448,Open the MANEUVERING THRUSTER controls.,o open e ilo lawa ni: ILO LILI PI WAWA TAWA.
CURRENT,tutorial_dockingmaneuver,2448,"Use your THRUSTERS to maneuver your ship so that RED diamonds of your docking ports align with the docking port of the *X.\n\nWhen aligned correctly, they will both turn YELLOW.\n\nKeep the ships aligned until the docking bridge is fully extended.",o kepeken ILO LILI PI WAWA TAWA. o tawa e ilo tawa sina kepeken nasin ni: leko LOJE pi lupa sina li lon sama lupa *X.\n\nlon pona la leko tu li kama JELO.\n\nlupa tu li poka pona la nasin lupa li wan e tu. pini ni ala la o awen pona e lon pi ilo tawa sina.
CURRENT,tutorial_dockingsuccess,2448,Well done. You have docked successfully!,Bien hecho. sina pona. sina poka lupa pona! pali pona.
CURRENT,tutorial_logistics_crew_title,2448,CREW LOGISTICS,TAWA JAN PI TOMO TAWA
CURRENT,tutorial_logisticscrewstart,2448,We are now going to learn how to transfer crew from one ship to another.\n\nThe two ships must be docked so that the crew can walk from one ship to another.,tenpo ni la o kama sona tawa e jan tawa tomo tawa wan tan ante.\n\ntomo tawa tu o poka lupa. poka lupa la jan li ken tan tomo wan tawa ante.
CURRENT,tutorial_logisticscrewswitchtonormalview,2448,"First, switch back to normal view by leaving tactical mode.",open la o tawa sitelen nasin tan weka pi nasin utala.
CURRENT,tutorial_logisticscrewselectship,2448,Select the UMC Astral Temptress. \n\n As you can see it has no crew.,o wile e ilo UMC Astral Temptress. \n\n sina ken lukin e ni: jan li weka.
CURRENT,tutorial_logisticscrewopen,2448,Open the Fleet Logistics window.,o open e lipu lawa pi tawa ilo
CURRENT,tutorial_logisticscrewselectfrom,2448,Select the SOURCE ship that the crew will come FROM.,o wile e tomo KAMA pi jan tawa.
CURRENT,tutorial_logisticscrewclicktarget,2448,Click in the CREW cell of the DESTINATION ship to request 5 crew to transfer.,o luka e POKI JAN lon tomo TAWA. ni li pana e lawa ni: o tawa e jan 5.
CURRENT,tutorial_logisticscrewclicktarget_shiftclick,2448,NOTE: You can SHIFT CLICK to request transfer in multiples of 5.,O SONA: wile tawa pi jan 5 lon tenpo la o LUKA SHIFT.
CURRENT,tutorial_logisticscrewwait,2448,Excellent. Now we just need to wait for the crew to transfer.,pona mute. tenpo ni la o awen tan tawa jan.
CURRENT,tutorial_logisticscrewsuccess,2448,Well done. You have transferred some crew successfully!,pona. sina tawa pona e jan!
CURRENT,tutorial_combat_title,2448,COMBAT,UTALA
CURRENT,tutorial_combatswitchtotacticalview,2448,Switch to tactical mode.,o tawa nasin utala.
CURRENT,tutorial_combatopenweaponscontrol,2448,Open the weapons control panel.,o open e sitelen lawa pi utala ilo.
CURRENT,tutorial_combatrange,2448,You can see the range of weapons by hovering over them. Weapons will shoot at enemy ships in their range.,sina ken lukin e suli nasin pi ilo utala lon nasin ni: o tawa e luka ona lon poka ona.
CURRENT,tutorial_combatselectcannon,2448,"Your guns can also target specific points on enemy ships.\n\nFirst, select which guns you would like to use.\n\nYou can SHIFT CLICK to select multiple guns.",ilo utala li ken kin pakala e ma wile lon ilo tawa ike.\n\nnanpa wan la o wile e ilo utala kepeken.\n\nwile pi ilo mute la sina ken LUKA SHIFT.
CURRENT,tutorial_combatselecttarget,2448,Target their weapon systems so that they can't damage you further.,o wile e ilo utala pi jan ike la ona li pakala ala e sina lon tenpo kama.
CURRENT,tutorial_combatbattlestations,2448,The effect of the EMP is wearing off!\n\nDeploy your weapons and make your crew ready to fight by clicking on BATTLE STATIONS.,pali EMP li kama pini!\n\no open e ilo utala. o ken e pali utala jan kepeken ni: o luka e POKI JAN UTALA.
CURRENT,tutorial_combatkeepmoving,2448,"Make sure to keep moving during combat, this increases your EVASION and makes you a harder target to hit.",pona la o tawa mute lon tenpo utala. tawa li suli e TAWA WEKA TAN PAKALA. ni la jan ike li ken ala pakala pona e sina.
CURRENT,tutorial_combatsuccess,2448,Well done. You have learned how to use weapons. Now fire at will at the pirate ship!,sina pona. sina kama sona e nasin pi ilo utala. tenpo ni la o pakala e jan ike lanpan!
CURRENT,tutorial_mining_title,2448,MINING,ALASA KIWEN
CURRENT,tutorial_miningstart,2448,We are now going to learn how to mine and collect resources from asteroids.,tenpo ni la o kama sona alasa kiwen tan kiwen mun.
CURRENT,tutorial_mininginstalllaser,2448,You will need a Mining Laser. These use a lot of power so consider installing extra reactors or batteries.\n\nInstall a MINING LASER and connect it to the power grid.,sina wile e ilo alasa kiwen suno.  ni li kepeken wawa mute la sina kin wile pana e ilo wawa e poki wawa namako.\n\no pana e ILO ALASA KIWEN SUNO.  o wan e ona e nasin wawa.
CURRENT,tutorial_miningundock,2448,Make sure to UNDOCK from any other ship (from the TACTICAL screen).,pona la o PINI E POKA LUPA tan tomo tawa ante ale (kepeken lipu pi NASIN UTALA).
CURRENT,tutorial_miningflytosystem,2448,"Look at the rocks on the map, these indicate ASTEROID BELTS. \n\nFly to a system in an asteroid belt, it will probably contain Tilium Ore.",o lukin e kiwen lon sitelen ma. ni li KULUPU KIWEN MUN. \n\no tawa kulupu sike lon kulupu kiwen. ken suli la ona li jo e kiwen Silija
CURRENT,tutorial_miningflytodeposit,2448,"This system seems to have asteroids containing Tilium Ore, fly close to one of them.",lukin la kulupu sike ni li jo e kiwen Silija lon kiwen mun.
CURRENT,tutorial_miningswitchtotactical,2448,Switch to tactical mode.,o tawa nasin utala
CURRENT,tutorial_miningopenweaponscontrol,2448,Open the weapons control panel.,o open e lipu lawa pi ilo utala
CURRENT,tutorial_miningrange,2448,You can see the range of mining lasers by hovering over them. Mining lasers will fire at mineral patches in their field of fire.,luka sina li lon poka la sina ken lukin e suli ken pi ilo alasa kiwen suno. ilo li pakala e kiwen lon ken ona.
CURRENT,tutorial_miningselectlaser,2448,"You can also target specific mineral patches.\n\nFirst, select which laser you would like to use.\n\nYou can SHIFT CLICK to select multiple lasers.",kin la sina ken wile e nasin alasa.\n\nopen la o wile e ilo alasa kepeken.\n\nwile pi ilo mute la o LUKA SHIFT.
CURRENT,tutorial_miningselecttarget,2448,Target a Tilium Ore patch by clicking on one while having a mining laser selected.,kepeken ilo alasa kiwen suno la o alasa e kiwen Silija kepeken luka.
CURRENT,tutorial_mininggetinrange,2448,Move your ship until the mineral patch is in the range of fire.,o tawa e ilo tawa sina lon poka kiwen.
CURRENT,tutorial_mininginstalldronebay,2448,Drones will collect mined resources.\n\nInstall a DRONE BAY so your drones can collect the Tilium Ore.,ilo tawa ilo li kama e kiwen.\n\no pana e TOMO PI ILO TAWA ILO la ilo li ken kama e kiwen Silija.
CURRENT,tutorial_miningfleetorders,2448,You also need to make sure that GATHER MATERIALS is enabled in FLEET ORDERS.,ni kin li wile: NASIN LAWA KULUPU li wile ken ALASA.
CURRENT,tutorial_mininginstallsmelter,2448,You will need to smelt the raw Tilium Ore to crystals.\n\nInstall a SMELTER.,sina wile pona e kiwen Silija tawa mani suno Silija.\n\no pana e ILO KIWEN SELI.
CURRENT,tutorial_miningsetsmelter,2448,Right click on the SMELTER and select TILIUM ORE to smelt it into Tilium Crystals.,o luka ante e ILO KIWEN SELI. o wile e KIWEN SILIJA. ni li pona e ona tawa mani suno Silija.
CURRENT,tutorial_miningwaitsmelter,2448,Perfect! Now wait for your smelter to smelt the Tilium Ore.,pona mute! tenpo ni la o awen taso tan pali Silija pi ilo kiwen seli.
CURRENT,tutorial_buyship_title,2448,PURCHASING SHIPS,ESUN PI ILO TAWA
CURRENT,tutorial_buyshipstart,2448,We are now going to learn about selecting and buying ships.,tenpo ni la o kama sona e nasin esun pi ilo tawa.
CURRENT,tutorial_buyshipinspect,2448,"Click on the JMC MINING STATION, an old unused industrial station for sale.",o luka e tomo JMC MINING STATION. tomo ni pi alasa kiwen li wile esun li kama tan tenpo pini.
CURRENT,tutorial_buyshipbuy,2448,Click on the BUY button to purchase the JMC MINING STATION.,o luka e nena ESUN. ni li esun e tomo JMC MINING STATION.
CURRENT,tutorial_buyshipsuccess,2448,"Well done, you have purchased the JMC MINING STATION.",sina pona. sina esun e tomo JMC MINING STATION
CURRENT,episode_part1,2448,PART 1,KIPISI 1
CURRENT,episode_part2,2448,PART 2,KIPISI 2
CURRENT,episode_part3,2448,PART 3,KIPISI 3
CURRENT,episode_part4,2448,PART 4,KIPISI 4
CURRENT,episode_part5,2448,PART 5,KIPISI 5
CURRENT,episode_episodecompleted,2448,EPISODE COMPLETED,PALI TOKI LI PINI
CURRENT,episode_awardreceived,2448,AWARD RECEIVED,PONA LI KAMA
CURRENT,opentextcrawlstory_1,2448,It is the 23rd century.  Humanity has colonised the stars.,ni li kulupu 23 pi sike suno.  jan li tawa ma mun li awen lon poka pi suno ante.
CURRENT,opentextcrawlstory_2,2448,"Millions now thrive on distant worlds, living hundreds of light years from Earth.",jan mute li pona lon ma sike ante. mute li weka mute tan ma sike open.
CURRENT,opentextcrawlstory_3,2448,"As space becomes the new frontier, an era of unprecedented exploration and expansion unfolds.",ma mun li ma wile sin la ni li tenpo sin. jan li tawa ma sin li kama suli.
CURRENT,opentextcrawlstory_4,2448,"Powerful corporations dominate entire regions, but beyond their reach lies uncharted territory, filled with untold mysteries and boundless opportunities.",kulupu esun wawa li lawa e ma suli. ma ante weka la jan ala li sona. nasa en ken mute li lon.
CURRENT,opentextcrawlstory_5,2448,The CEO of the INTERSTELLAR MINING CORPORATION has issued a daring challenge: build a stargate powerful enough to reach our nearest galaxy.,wan li KULUPU INTERSTELLAR PI ALASA KIWEN. jan lawa ona li toki e ni tawa jan ale: o pali e lupa mun. lupa ni la jan li ken tawa kulupu suli ante pi suno mun.
CURRENT,opentextcrawlstory_6,2448,"With trillions in funding up for grabs, the stage is set for fearless adventurers to forge their own path in the cosmos.",mani mute mute li tawa ni la ken ni li lon: jan pi monsuta ala li ken pali e nasin sin lon ale mun.
CURRENT,opentextcrawlstory_7,2448,"Will you rise to the challenge, and chart your own course among the stars?",sina pilin monsuta ala monsuta? sina pali e nasin sina lon ale mun?
